{"grao":"1 linha por subconjunto de segmentos × par de departamentos","dimensoes":{"subconjunto":["todos","Fiéis","Regulares","Fiéis+Regulares","Esporádicos","Fiéis+Esporádicos","Regulares+Esporádicos","Fiéis+Regulares+Esporádicos","Em pausa","Fiéis+Em pausa","Regulares+Em pausa","Fiéis+Regulares+Em pausa","Esporádicos+Em pausa","Fiéis+Esporádicos+Em pausa","Regulares+Esporádicos+Em pausa","Fiéis+Regulares+Esporádicos+Em pausa"],"departamento_a":["AUTOMOTIVE","CHEF SHOPPE","COSMETICS","DELI","DELI/SNACK BAR","DRUG GM","FLORAL","FROZEN GROCERY","GARDEN CENTER","GROCERY","MEAT","MEAT-PCKGD","MEAT-WHSE","NUTRITION","PASTRY","PHOTO","POSTAL CENTER","PRODUCE","RESTAURANT","SALAD BAR","SEAFOOD","SEAFOOD-PCKGD","SPIRITS"],"departamento_b":["COSMETICS","DELI","DRUG GM","FLORAL","GROCERY","MEAT","MEAT-PCKGD","NUTRITION","PASTRY","PRODUCE","SALAD BAR","SEAFOOD-PCKGD","FROZEN GROCERY","RESTAURANT","SEAFOOD","SPIRITS","TRAVEL & LEISUR","DELI/SNACK BAR","GARDEN CENTER","PHOTO","MEAT-WHSE","POSTAL CENTER","RX","VIDEO"]},"colunas":["subconjunto","departamento_a","departamento_b","cestas_par","cestas_a","cestas_b","cestas_total","suporte","confianca_a_b","confianca_b_a","lift","amostra_pequena"],"linhas":[[0,0,0,1,19,1479,68947,1.5e-05,0.0526,0.0007,2.4535,true],[0,0,1,5,19,9791,68947,7.3e-05,0.2632,0.0005,1.8531,true],[0,0,2,15,19,33292,68947,0.000218,0.7895,0.0005,1.635,true],[0,0,3,1,19,1083,68947,1.5e-05,0.0526,0.0009,3.3507,true],[0,0,4,17,19,59593,68947,0.000247,0.8947,0.0003,1.0352,true],[0,0,5,2,19,14979,68947,2.9e-05,0.1053,0.0001,0.4845,true],[0,0,6,6,19,16200,68947,8.7e-05,0.3158,0.0004,1.344,true],[0,0,7,5,19,4917,68947,7.3e-05,0.2632,0.001,3.69,true],[0,0,8,1,19,8540,68947,1.5e-05,0.0526,0.0001,0.4249,true],[0,0,9,9,19,24475,68947,0.000131,0.4737,0.0004,1.3344,true],[0,0,10,1,19,2341,68947,1.5e-05,0.0526,0.0004,1.5501,true],[0,0,11,1,19,2646,68947,1.5e-05,0.0526,0.0004,1.3714,true],[0,1,0,11,304,1479,68947,0.00016,0.0362,0.0074,1.6868,true],[0,1,1,95,304,9791,68947,0.001378,0.3125,0.0097,2.2006,true],[0,1,2,204,304,33292,68947,0.002959,0.6711,0.0061,1.3897,false],[0,1,3,6,304,1083,68947,8.7e-05,0.0197,0.0055,1.2565,true],[0,1,12,5,304,102,68947,7.3e-05,0.0164,0.049,11.1176,true],[0,1,4,294,304,59593,68947,0.004264,0.9671,0.0049,1.1189,false],[0,1,5,182,304,14979,68947,0.00264,0.5987,0.0122,2.7557,true],[0,1,6,159,304,16200,68947,0.002306,0.523,0.0098,2.226,true],[0,1,7,75,304,4917,68947,0.001088,0.2467,0.0153,3.4594,true],[0,1,8,85,304,8540,68947,0.001233,0.2796,0.01,2.2574,true],[0,1,9,273,304,24475,68947,0.00396,0.898,0.0112,2.5298,false],[0,1,13,1,304,131,68947,1.5e-05,0.0033,0.0076,1.7313,true],[0,1,10,20,304,2341,68947,0.00029,0.0658,0.0085,1.9376,true],[0,1,14,24,304,963,68947,0.000348,0.0789,0.0249,5.6523,true],[0,1,11,35,304,2646,68947,0.000508,0.1151,0.0132,3.0,true],[0,1,15,3,304,575,68947,4.4e-05,0.0099,0.0052,1.1833,true],[0,1,16,3,304,339,68947,4.4e-05,0.0099,0.0088,2.0071,true],[0,2,1,291,1479,9791,68947,0.004221,0.1968,0.0297,1.3855,false],[0,2,17,3,1479,7,68947,4.4e-05,0.002,0.4286,19.9788,true],[0,2,2,1157,1479,33292,68947,0.016781,0.7823,0.0348,1.6201,false],[0,2,3,40,1479,1083,68947,0.00058,0.027,0.0369,1.7218,true],[0,2,12,7,1479,102,68947,0.000102,0.0047,0.0686,3.1992,true],[0,2,18,5,1479,60,68947,7.3e-05,0.0034,0.0833,3.8848,true],[0,2,4,1243,1479,59593,68947,0.018028,0.8404,0.0209,0.9724,false],[0,2,5,444,1479,14979,68947,0.00644,0.3002,0.0296,1.3818,false],[0,2,6,471,1479,16200,68947,0.006831,0.3185,0.0291,1.3554,false],[0,2,7,204,1479,4917,68947,0.002959,0.1379,0.0415,1.9341,false],[0,2,8,225,1479,8540,68947,0.003263,0.1521,0.0263,1.2282,false],[0,2,19,1,1479,6,68947,1.5e-05,0.0007,0.1667,7.7696,true],[0,2,9,750,1479,24475,68947,0.010878,0.5071,0.0306,1.4285,false],[0,2,13,3,1479,131,68947,4.4e-05,0.002,0.0229,1.0676,true],[0,2,10,45,1479,2341,68947,0.000653,0.0304,0.0192,0.8961,true],[0,2,14,40,1479,963,68947,0.00058,0.027,0.0415,1.9363,true],[0,2,11,82,1479,2646,68947,0.001189,0.0554,0.031,1.4447,true],[0,2,15,4,1479,575,68947,5.8e-05,0.0027,0.007,0.3243,true],[0,2,16,16,1479,339,68947,0.000232,0.0108,0.0472,2.2002,true],[0,3,17,1,9791,7,68947,1.5e-05,0.0001,0.1429,1.006,true],[0,3,2,5139,9791,33292,68947,0.074536,0.5249,0.1544,1.087,false],[0,3,3,196,9791,1083,68947,0.002843,0.02,0.181,1.2744,true],[0,3,12,48,9791,102,68947,0.000696,0.0049,0.4706,3.3138,true],[0,3,18,13,9791,60,68947,0.000189,0.0013,0.2167,1.5257,true],[0,3,4,8999,9791,59593,68947,0.130521,0.9191,0.151,1.0634,false],[0,3,5,3377,9791,14979,68947,0.04898,0.3449,0.2254,1.5876,false],[0,3,6,3589,9791,16200,68947,0.052054,0.3666,0.2215,1.5601,false],[0,3,20,2,9791,6,68947,2.9e-05,0.0002,0.3333,2.3473,true],[0,3,7,1265,9791,4917,68947,0.018347,0.1292,0.2573,1.8117,false],[0,3,8,2322,9791,8540,68947,0.033678,0.2372,0.2719,1.9147,false],[0,3,19,1,9791,6,68947,1.5e-05,0.0001,0.1667,1.1736,true],[0,3,21,1,9791,13,68947,1.5e-05,0.0001,0.0769,0.5417,true],[0,3,9,5770,9791,24475,68947,0.083687,0.5893,0.2358,1.6601,false],[0,3,13,44,9791,131,68947,0.000638,0.0045,0.3359,2.3652,true],[0,3,22,3,9791,8,68947,4.4e-05,0.0003,0.375,2.6407,true],[0,3,10,510,9791,2341,68947,0.007397,0.0521,0.2179,1.5341,false],[0,3,14,266,9791,963,68947,0.003858,0.0272,0.2762,1.9451,false],[0,3,11,726,9791,2646,68947,0.01053,0.0741,0.2744,1.9321,false],[0,3,15,78,9791,575,68947,0.001131,0.008,0.1357,0.9552,true],[0,3,16,100,9791,339,68947,0.00145,0.0102,0.295,2.0772,true],[0,3,23,1,9791,3,68947,1.5e-05,0.0001,0.3333,2.3473,true],[0,4,2,7,7,33292,68947,0.000102,1.0,0.0002,2.071,true],[0,4,4,6,7,59593,68947,8.7e-05,0.8571,0.0001,0.9917,true],[0,4,5,2,7,14979,68947,2.9e-05,0.2857,0.0001,1.3151,true],[0,4,6,2,7,16200,68947,2.9e-05,0.2857,0.0001,1.216,true],[0,4,8,4,7,8540,68947,5.8e-05,0.5714,0.0005,4.6134,true],[0,4,9,4,7,24475,68947,5.8e-05,0.5714,0.0002,1.6097,true],[0,5,3,602,33292,1083,68947,0.008731,0.0181,0.5559,1.1512,false],[0,5,12,55,33292,102,68947,0.000798,0.0017,0.5392,1.1167,true],[0,5,18,29,33292,60,68947,0.000421,0.0009,0.4833,1.001,true],[0,5,4,27110,33292,59593,68947,0.393201,0.8143,0.4549,0.9421,false],[0,5,5,7869,33292,14979,68947,0.114131,0.2364,0.5253,1.088,false],[0,5,6,8829,33292,16200,68947,0.128055,0.2652,0.545,1.1287,false],[0,5,20,2,33292,6,68947,2.9e-05,0.0001,0.3333,0.6903,true],[0,5,7,2856,33292,4917,68947,0.041423,0.0858,0.5808,1.2029,false],[0,5,8,4302,33292,8540,68947,0.062396,0.1292,0.5037,1.0432,false],[0,5,19,6,33292,6,68947,8.7e-05,0.0002,1.0,2.071,true],[0,5,21,10,33292,13,68947,0.000145,0.0003,0.7692,1.5931,true],[0,5,9,12897,33292,24475,68947,0.187057,0.3874,0.5269,1.0913,false],[0,5,13,55,33292,131,68947,0.000798,0.0017,0.4198,0.8695,true],[0,5,22,7,33292,8,68947,0.000102,0.0002,0.875,1.8121,true],[0,5,10,1015,33292,2341,68947,0.014721,0.0305,0.4336,0.8979,false],[0,5,14,521,33292,963,68947,0.007557,0.0156,0.541,1.1204,false],[0,5,11,1506,33292,2646,68947,0.021843,0.0452,0.5692,1.1787,false],[0,5,15,296,33292,575,68947,0.004293,0.0089,0.5148,1.0661,false],[0,5,16,225,33292,339,68947,0.003263,0.0068,0.6637,1.3745,false],[0,5,23,1,33292,3,68947,1.5e-05,0.0,0.3333,0.6903,true],[0,6,12,2,1083,102,68947,2.9e-05,0.0018,0.0196,1.2483,true],[0,6,18,2,1083,60,68947,2.9e-05,0.0018,0.0333,2.1221,true],[0,6,4,721,1083,59593,68947,0.010457,0.6657,0.0121,0.7702,false],[0,6,5,197,1083,14979,68947,0.002857,0.1819,0.0132,0.8373,true],[0,6,6,211,1083,16200,68947,0.00306,0.1948,0.013,0.8292,false],[0,6,7,115,1083,4917,68947,0.001668,0.1062,0.0234,1.489,true],[0,6,8,198,1083,8540,68947,0.002872,0.1828,0.0232,1.476,true],[0,6,9,443,1083,24475,68947,0.006425,0.409,0.0181,1.1523,false],[0,6,13,1,1083,131,68947,1.5e-05,0.0009,0.0076,0.486,true],[0,6,10,26,1083,2341,68947,0.000377,0.024,0.0111,0.7071,true],[0,6,14,25,1083,963,68947,0.000363,0.0231,0.026,1.6527,true],[0,6,11,51,1083,2646,68947,0.00074,0.0471,0.0193,1.2271,true],[0,6,15,8,1083,575,68947,0.000116,0.0074,0.0139,0.8857,true],[0,6,16,11,1083,339,68947,0.00016,0.0102,0.0324,2.0658,true],[0,7,4,97,102,59593,68947,0.001407,0.951,0.0016,1.1003,true],[0,7,5,52,102,14979,68947,0.000754,0.5098,0.0035,2.3466,true],[0,7,6,37,102,16200,68947,0.000537,0.3627,0.0023,1.5438,true],[0,7,7,44,102,4917,68947,0.000638,0.4314,0.0089,6.0488,true],[0,7,8,27,102,8540,68947,0.000392,0.2647,0.0032,2.1371,true],[0,7,9,94,102,24475,68947,0.001363,0.9216,0.0038,2.5961,true],[0,7,10,4,102,2341,68947,5.8e-05,0.0392,0.0017,1.155,true],[0,7,14,9,102,963,68947,0.000131,0.0882,0.0093,6.3173,true],[0,7,11,13,102,2646,68947,0.000189,0.1275,0.0049,3.321,true],[0,7,15,1,102,575,68947,1.5e-05,0.0098,0.0017,1.1756,true],[0,7,16,1,102,339,68947,1.5e-05,0.0098,0.0029,1.994,true],[0,8,4,35,60,59593,68947,0.000508,0.5833,0.0006,0.6749,true],[0,8,5,15,60,14979,68947,0.000218,0.25,0.001,1.1507,true],[0,8,6,12,60,16200,68947,0.000174,0.2,0.0007,0.8512,true],[0,8,7,9,60,4917,68947,0.000131,0.15,0.0018,2.1033,true],[0,8,8,11,60,8540,68947,0.00016,0.1833,0.0013,1.4801,true],[0,8,9,30,60,24475,68947,0.000435,0.5,0.0012,1.4085,true],[0,8,10,3,60,2341,68947,4.4e-05,0.05,0.0013,1.4726,true],[0,8,14,1,60,963,68947,1.5e-05,0.0167,0.001,1.1933,true],[0,8,11,3,60,2646,68947,4.4e-05,0.05,0.0011,1.3029,true],[0,8,16,1,60,339,68947,1.5e-05,0.0167,0.0029,3.3897,true],[0,9,5,14474,59593,14979,68947,0.209929,0.2429,0.9663,1.118,false],[0,9,6,15799,59593,16200,68947,0.229147,0.2651,0.9752,1.1283,false],[0,9,20,6,59593,6,68947,8.7e-05,0.0001,1.0,1.157,true],[0,9,7,4490,59593,4917,68947,0.065122,0.0753,0.9132,1.0565,false],[0,9,8,7664,59593,8540,68947,0.111158,0.1286,0.8974,1.0383,false],[0,9,19,6,59593,6,68947,8.7e-05,0.0001,1.0,1.157,true],[0,9,21,10,59593,13,68947,0.000145,0.0002,0.7692,0.89,true],[0,9,9,23243,59593,24475,68947,0.337114,0.39,0.9497,1.0987,false],[0,9,13,82,59593,131,68947,0.001189,0.0014,0.626,0.7242,true],[0,9,22,6,59593,8,68947,8.7e-05,0.0001,0.75,0.8677,true],[0,9,10,1887,59593,2341,68947,0.027369,0.0317,0.8061,0.9326,false],[0,9,14,912,59593,963,68947,0.013228,0.0153,0.947,1.0957,false],[0,9,11,2563,59593,2646,68947,0.03717